video_url,user_url,username,title,view_num,created_at,shortdesc,collected_at
/watch?v=5vjl6tdwmFA&pp=ygURc3BhY2UgZXhwbG9yYXRpb24%3D,/@HISTORY,HISTORY,The Universe: Dangerous DARK MATTER & Space Travel *3 Hour Marathon*,831K,2 months,What is REALLY hiding in our deep dark solar system? See more in this three hour marathon from The Universe. #TheUniverse ...,2024-01-30 07:56:32.682774
/watch?v=PlBzMx2On-g&pp=ygURc3BhY2UgZXhwbG9yYXRpb24%3D,/@SparkDocs,Spark,The Complete History Of Space Exploration | Beyond Our Earth | Spark,38K,9 months,"From Cold War competition to international collaboration, In Our Orbit traces the missions that surpassed each frontier, from the ...",2024-01-30 07:56:32.691348
/watch?v=7e5SK1JKa7U&pp=ygURc3BhY2UgZXhwbG9yYXRpb24%3D,/channel/UCstsO2Wf4sCWjauPZs35tlQ,Celestial Ambience,Space Exploration Music 🌠 Sleep / Focus / Study 10 Hours,392K,2 years,Exploring the cosmos... ⭐️ Original Music and Animation ⭐️ Track: Exploration Artist: Celestial Ambience ...,2024-01-30 07:56:32.701165
/watch?v=U-ARGAxePp4&pp=ygURc3BhY2UgZXhwbG9yYXRpb24%3D,/@TVQuantumUniverse,TV - Quantum Universe,"Space Exploration and NASA Colonization Plans, Documentary on Our Future Voyages to the Universe",341K,1 year,"Is it time for another 'giant leap?' In 2080, NASA scientists believe we can and must send people to Jupiter's and Saturn's moons.",2024-01-30 07:56:41.479710
/watch?v=cm8OHGvl4Oc&pp=ygURc3BhY2UgZXhwbG9yYXRpb24%3D,/@WorldScienceFestival,World Science Festival,The New Golden Age of Space Exploration,94K,6 months,"space #NASA #JWST In the next two decades, human beings will return to the moon, set foot on Mars, and launch telescopes ...",2024-01-30 07:56:41.487070
/watch?v=FUChrd72SQU&pp=ygURc3BhY2UgZXhwbG9yYXRpb24%3D,/@PBSNewsHour,PBS NewsHour,A look at 2023's discoveries in space exploration,46K,4 weeks,"In 2023, we saw incredibly detailed images from the most advanced telescope in space and the 25th year of a global partnership ...",2024-01-30 07:56:41.490279
/watch?v=8hRJ-CcwvrI&pp=ygURc3BhY2UgZXhwbG9yYXRpb24%3D,/@DoshDoshington,DoshDoshington,How hard is it to beat SPACE EXPLORATION | The 300 Hour Factorio Mod,2.3M,1 year,0:00 Intro 0:53 Run Starts 6:13 Actual Science 17:30 First Satellite 25:03 In Space 39:42 Expanding 45:34 Base Number Two ...,2024-01-30 07:56:41.500316
/watch?v=eNmfRHZeNHE&pp=ygURc3BhY2UgZXhwbG9yYXRpb24%3D,/@Exolifespace,Exolife,Unusual Phenomena in the Cosmos. A Deep Space Exploration,70K,1 month,Are you curious about the secrets of the universe? Do you want to learn about the most unusual phenomena in the cosmos?,2024-01-30 07:56:41.510838
/watch?v=aDEjWB9G0p4&pp=ygURc3BhY2UgZXhwbG9yYXRpb24%3D,/@NEWSCENTERMaine,NEWS CENTER Maine,NASA delays launch for SpaceX Crew-8 mission,263,1 day,"... commercial crew program is being delayed until late February, mainly because of the high volume of space travel happening ...",2024-01-30 07:56:41.517291
/watch?v=PLcE3AI9wwE&pp=ygURc3BhY2UgZXhwbG9yYXRpb24%3D,/@DavidPetersonAU,David Peterson,Escape Velocity - A Quick History of Space Exploration,4.8M,7 years,"From the first rocket launch in 1926 to Gagarin, Armstrong, Hubble, Curiosity and beyond, take a fast ride through the 90 years of ...",2024-01-30 07:56:41.518991
/watch?v=GKWrOLrp80c&pp=ygURc3BhY2UgZXhwbG9yYXRpb24%3D,/@TheHistoryGuyChannel,The History Guy: History Deserves to Be Remembered,Best of:  Space  Exploration,27K,3 months,"THG is travelling with limited posting. in the mean time, enjoy this collection of classic episodes on NASA Space Probes.",2024-01-30 07:56:41.528677
/watch?v=VW5LQDR7A_s&pp=ygURc3BhY2UgZXhwbG9yYXRpb24%3D,/@SparkDocs,Spark,The Technologies That Revolutionized Space Exploration | Zenith Compilation | Spark,4M,1 year,"From telescopes to rocket launchers, space exploration would not be possible without the advance in technology. Watch to ...",2024-01-30 07:56:41.530697
/watch?v=pJZQlX2Fs7A&pp=ygURc3BhY2UgZXhwbG9yYXRpb24%3D,/@BBCEarthScience,BBC Earth Science,Exploring our Mind-Blowing Universe | BBC Earth Science,534K,1 month,Embark on a fascinating journey through the wonders of our universe in this mind-expanding exploration of celestial marvels and ...,2024-01-30 07:56:41.532917
/watch?v=wdP_UDSsuro&pp=ygURc3BhY2UgZXhwbG9yYXRpb24%3D,/@pbsspacetime,PBS Space Time,Is Interstellar Travel Impossible?,3.3M,1 year,"Space is pretty deadly. But is it so deadly that we're effectively imprisoned in our solar system forever? Many have said so, but a ...",2024-01-30 07:56:41.547818
/watch?v=nhbHWESV5FQ&pp=ygURc3BhY2UgZXhwbG9yYXRpb24%3D,/@NeverKnowsBest,NeverKnowsBest,An in-depth look at Space Exploration in video games,329K,3 months,"Space… the final frontier... for humanity and game developers both, apparently. 0:00 - Introduction 2:02 - The History of Space ...",2024-01-30 07:56:41.549841
/shorts/JnWJpGkLXtQ,/@AstroKobi,AstroKobi,This is The Future of Space Travel! #space #nasa #elonmusk,2.8M,1 year,As Humanity continues to colonize space we're going to need some new rockets to speed things up because our current Rockets ...,2024-01-30 07:56:41.551754
/watch?v=3JuKR7jf46o&pp=ygURc3BhY2UgZXhwbG9yYXRpb24%3D,/@SpaceJunkies,Space Junkies,The History of Space Exploration: a Timeline,107K,2 years,"Let us to take you back through the timeline of space exploration and its rich, fascinating history. Starting in 1946, with a ...",2024-01-30 07:56:41.564461
/watch?v=hUBW6dMQN4E&pp=ygURc3BhY2UgZXhwbG9yYXRpb24%3D,/@HISTORY,HISTORY,"The Universe: Epic Journey to Space (S2, E8) | Full Episode",167K,1 year,"Today scientists are proposing a bizarre array of technologies, in Season 2, Episode 8, ""Space Travel."" #TheUniverse Subscribe ...",2024-01-30 07:56:41.568005
/shorts/zliaeMdpy4M,/@freethink,Freethink,MIT's electric thrusters could revolutionize deep space exploration #shorts,7.5M,8 months,"These tiny electrospray thrusters cut spacecraft payload so that we can explore the asteroid belt, outer planets, and beyond.",2024-01-30 07:56:41.570506
/watch?v=68PlPkeOwng&pp=ygURc3BhY2UgZXhwbG9yYXRpb24%3D,/@FD_Engineering,Free Documentary - Engineering,Advances in Space Technology: Everything You Need to Know | Complete Series | FD Engineering,576K,7 months,... #FreeDocumentary #Documentary #spaceexploration ▭▭▭▭▭▭▭▭▭ “Engineering: the branch of science and technology ...,2024-01-30 07:56:41.573494
/watch?v=lREc3HhTz98&pp=ygURc3BhY2UgZXhwbG9yYXRpb24%3D,/@spacemattersdoc,Space Matters,Solar System Journey: Exploring the Wonders of Outer Space,415K,7 months,"In this Solar System Journey: Exploring the Wonders of Outer Space documentary, you'll be taken on a journey through our outer ...",2024-01-30 07:56:50.178168
/watch?v=kqrahBJkKAs&pp=ygURc3BhY2UgZXhwbG9yYXRpb24%3D,/@TEDx,TEDx Talks,Space Exploration is the Worst | Emily Calandrelli | TEDxIndianaUniversity,869K,8 years,"Opening for TEDxIndianaUniversity was Xploration Outer Space producer and star, Emily Calandrelli's tongue in cheek summary ...",2024-01-30 07:56:50.185138
/watch?v=egDIqKLt2L4&pp=ygURc3BhY2UgZXhwbG9yYXRpb24%3D,/@now_next,Now Next,Mysteries of the Universe | Space Documentary 2023,908K,7 months,"In the vast expanse of the cosmos, where stars shimmer and galaxies collide, lies a tapestry of mysteries waiting to be unraveled.",2024-01-30 07:56:50.194842
/watch?v=FAr_8cNL1nk&pp=ygURc3BhY2UgZXhwbG9yYXRpb24%3D,/@EuropeanSpaceAgency,"European Space Agency, ESA",Europe's future of space travel,264K,3 weeks,"For 40 years, ESA has been shaping the future in space, while delivering crucial access to space for Europe. That work continues ...",2024-01-30 07:56:50.199142
/watch?v=1Upxg0D-Eiw&pp=ygURc3BhY2UgZXhwbG9yYXRpb24%3D,/@planetarysociety,The Planetary Society,Is space exploration worth the money?,36K,1 year,"This video is for anyone who has ever asked: ""Should we really be spending money on space when there are problems to deal ...",2024-01-30 07:56:50.205478
/watch?v=LTxuUs9YWoc&pp=ygURc3BhY2UgZXhwbG9yYXRpb24%3D,/@KosmoDOC,Kosmo DOC,To Reach the Nearest Stars [Space Documentary 2023],296K,4 months,... cooperation - kosmo.pdt@gmail.com We live in the era of great space exploration. So far dozens of probes have reached the ...,2024-01-30 07:56:50.210865
/watch?v=R-eIUxwcQo4&pp=ygURc3BhY2UgZXhwbG9yYXRpb24%3D,/@pbsspacetime,PBS Space Time,How Far Beyond Earth Could Humanity Spread?,944K,9 months,We humans have always been explorers. The great civilizations that have arisen across the world are owed to our restless ...,2024-01-30 07:56:50.216636
/watch?v=R5hZ2X9-TIQ&pp=ygURc3BhY2UgZXhwbG9yYXRpb24%3D,/@DoshDoshington,DoshDoshington,How Hard is it to Beat Space Exploration | The Final Frontier,757K,1 year,Music Used: Stargate Theme Command & Conquer Red Alert 2 - Military 2 Kapten Floede - Filosoferna - No Touch ...,2024-01-30 07:56:50.222280
/shorts/_b88VR8fxJM,/@ancientegyptandthebible,Ancient Egypt and the Bible,Is space exploration off limits according to the Bible?  #shorts,2.2K,1 year,The heavens are the Lord's and the earth belongs to mankind. But the topic of space exploration is more complicated than that as ...,2024-01-30 07:56:50.228150
/watch?v=gpX7mwnmi10&pp=ygURc3BhY2UgZXhwbG9yYXRpb24%3D,/@jakov_edits,Jakov from Wogastisburg,SPACE EXPLORATION - Edit,12K,11 months,#littledarkage #sun #mercury #venus #earth #mars #asteroid #jupiter #saturn #uranus #neptune #pluto #ceres #makemake ...,2024-01-30 07:56:50.233363
/watch?v=QHVAERH4yzc&pp=ygURc3BhY2UgZXhwbG9yYXRpb24%3D,/@CNBC,CNBC,The Future Of The Space Economy | CNBC Marathon,397K,1 month,"CNBC Marathon explores the current space economy and how new endeavors for space travel, exploration and mining are being ...",2024-01-30 07:56:50.239891
/shorts/WwbqlHkQQsE,/@the_science_fact,The Science Fact,Astrophysicist Neil deGrasse Tyson on NASA Budget #spaceexploration,1.2M,8 months,... half of one percent that made the space station and the space shuttles and the Hubble telescope and all the NASA centers all of ...,2024-01-30 07:56:50.245602
/shorts/LkAAhJaTtVs,/@AstroKobi,AstroKobi,Space Travel can be Dangerous for humans…,690K,7 months,I would bet that in your lifetime we will begin taking tourist flights into space but what would that do to the human body but we all ...,2024-01-30 07:56:50.251592
/watch?v=ujFDrncpCjo&pp=ygURc3BhY2UgZXhwbG9yYXRpb24%3D,/@spacemattersdoc,Space Matters,Journey into Outer Space: Life Within the Universe | Space Documentary,1.1M,11 months,"In this space documentary, we journey into the universe to explore the life beyond the planet Earth. From the edges of our solar ...",2024-01-30 07:56:50.259541
/watch?v=Dp5xnT55_XA&pp=ygURc3BhY2UgZXhwbG9yYXRpb24%3D,/@space_academy,Space Academy,The History of Space Exploration | A Short Documentary,4.7K,1 year,"Welcome to our latest video, ""The History of Space Exploration: A Short Documentary""! This video takes you on a journey through ...",2024-01-30 07:56:50.267443
/watch?v=81JmjIBsx60&pp=ygURc3BhY2UgZXhwbG9yYXRpb24%3D,/@DoshDoshington,DoshDoshington,How Hard is it to Beat SPACE EXPLORATION | The Second Coming,1M,1 year,0:00 Space Base #2 (mistake) 7:42 Astronomic Science 11:13 Verbti 24:08 Calidus Asteroid Belt 30:45 Wayland 42:00 Buttercup ...,2024-01-30 07:56:50.281880
/watch?v=YXXlSG-du7c&pp=ygURc3BhY2UgZXhwbG9yYXRpb24%3D,/@dudeperfect,Dude Perfect,Dude Perfect Goes to SPACE,36M,1 year,-- From the MoonDAO team -- MoonDAO is a transparent governance project for decentralizing access to space research and ...,2024-01-30 07:56:50.287330
/watch?v=FzP7UI_9xoo&pp=ygURc3BhY2UgZXhwbG9yYXRpb24%3D,/@futurize456,Futurize,"Neil deGrasse Tyson:"" Voyager 1 Has Detected 500 Unknown Objects Passing By In Space""",747K,7 months,"... the Voyager's message really means, and how it might just change the way we've thought about space exploration, forever.",2024-01-30 07:56:50.295242
/watch?v=rqUaaEsFW_M&pp=ygURc3BhY2UgZXhwbG9yYXRpb24%3D,/@VentureCity,Venture City,The Next 200 Years of SPACE COLONIZATION (Timelapse),759K,7 months,"A sci fi documentary exploring a timelapse of future space colonization. Travel through 300 years, from 2052 to 2301 and beyond, ...",2024-01-30 07:57:00.340660
/watch?v=_6J4J7jP8rU&pp=ygURc3BhY2UgZXhwbG9yYXRpb24%3D,/@FuturologyChannel,Futurology,NASA’s $93BN Plan to Return to the Moon,1.3M,9 months,"In two years, NASA plans to land humans on the Moon! NASA's Artemis Program, which will establish a permanent human ...",2024-01-30 07:57:00.350738
/watch?v=uxR3lNJnga0&pp=ygURc3BhY2UgZXhwbG9yYXRpb24%3D,/@TechBangTV,Tech Bang!,Scariest Things Said By NASA Astronauts,1.9M,1 year,"Astronauts are supposed to be by themselves in space, which is a frightening, overwhelming place. Therefore, it is reasonable to ...",2024-01-30 07:57:00.362928
/watch?v=KZBjrwqxfnk&pp=ygURc3BhY2UgZXhwbG9yYXRpb24%3D,/@Seeker,Seeker,What Is Space Exploration Doing For You?,237K,9 years,People ask all the time whether the money we put into space exploration actually helps us here on Earth. Is it worth the money ...,2024-01-30 07:57:00.367905
/watch?v=xAuxvVBMykI&pp=ygURc3BhY2UgZXhwbG9yYXRpb24%3D,/@VFXProductionsRT,VFX Productions,EXPLORATION - Inspirational NASA Space Film,329K,8 years,"EXPLORATION is an inspirational piece reconnecting history with the present, mainly focussing around the Apollo 11 mission of ...",2024-01-30 07:57:00.376650
/watch?v=ExfLBIZwRpo&pp=ygURc3BhY2UgZXhwbG9yYXRpb24%3D,/@DWDocumentary,DW Documentary,How private companies are aiming for the stars | DW Documentary,552K,7 months,"But state-sponsored space exploration is still indispensable. The science documentary ""New Space Race"" gained exclusive ...",2024-01-30 07:57:00.387472
/watch?v=HPQLuyM-i3A&pp=ygURc3BhY2UgZXhwbG9yYXRpb24%3D,/@1Dimee,1Dime,The Problem with Space Exploration,14K,1 year,This is a video about The Space Economy and the Geopolitics of space exploration under capitalism versus the potentials of ...,2024-01-30 07:57:00.397816
/watch?v=lqc0AQ3Rx7o&pp=ygURc3BhY2UgZXhwbG9yYXRpb24%3D,/@KosmoDOC,Kosmo DOC,Mysteries of the Universe. A Journey into Deep Space [Space Documentary 2023],662K,1 year,"➥ Kosmo - youtube.com/@kosmo_off ➥ TokTok - tiktok.com/@kosmo_eng ➥ Advertising, cooperation - kosmo.pdt@gmail.com ...",2024-01-30 07:57:00.406469
/watch?v=chv6_seOaWw&pp=ygURc3BhY2UgZXhwbG9yYXRpb24%3D,/@whatdamath,Anton Petrov,Incredible Advances In Nuclear Stirling Engines For Space Exploration,311K,8 months,Bitcoin/Ethereum to spare? Donate them here to help this channel grow! bc1qnkl3nk0zt7w0xzrgur9pnkcduj7a3xxllcn7d4 or ETH: ...,2024-01-30 07:57:00.411711
/watch?v=A8v8QdS-omY&pp=ygURc3BhY2UgZXhwbG9yYXRpb24%3D,/@SecondThought,Second Thought,What's the Point of Space Exploration?,132K,5 years,New video every Friday! Follow Second Thought on Social Media! Twitter: https://twitter.com/_SecondThought Facebook: ...,2024-01-30 07:57:00.421816
/watch?v=PP8pcf4vF8U&pp=ygURc3BhY2UgZXhwbG9yYXRpb24%3D,/@Nilaus,Nilaus,ASTRONOMICS SCIENCE 1 In Factorio Space Exploration | Guide/Walkthrough,9.4K,11 days,FACTORIO SPACE EXPLORATION Build Cargo Rockets to launch stuff into space. Ride a rocket into space yourself and start ...,2024-01-30 07:57:00.429558
/watch?v=ylr-nGaB1-0&pp=ygURc3BhY2UgZXhwbG9yYXRpb24%3D,/@primalspace,Primal Space,The Most Efficient Space Program In The World,1M,3 years,Is this the most efficient space program in the world? Throughout the history of spaceflight we've seen some incredible ...,2024-01-30 07:57:00.433505
/watch?v=GRJ71RVWfeo&pp=ygURc3BhY2UgZXhwbG9yYXRpb24%3D,/@astrumspace,Astrum,This Is What Happens When You Let AI Design a Spacecraft,255K,7 months,Become a Patron today and support my channel! Donate link above. I can't do it without you. Thanks to those who have supported ...,2024-01-30 07:57:00.442802
/watch?v=1yBwWLunlOM&pp=ygURc3BhY2UgZXhwbG9yYXRpb24%3D,/@NatGeo,National Geographic,Rockets 101 | National Geographic,5.2M,4 years,"Learn about how rockets work, what happens during a launch, and how centuries of innovation made space exploration possible.",2024-01-30 07:57:00.450351
/watch?v=csFyhYSLwic&pp=ygURc3BhY2UgZXhwbG9yYXRpb24%3D,/@CBSNews,CBS News,New technology aims to put a whole new spin on space travel,1.7M,4 months,A new form of technology is trying to send items into space with an innovative new method. The SpinLaunch aims to reduce the ...,2024-01-30 07:57:00.453686
/watch?v=2QgWj1iDg18&pp=ygURc3BhY2UgZXhwbG9yYXRpb24%3D,/@NatGeo,National Geographic,Bill Nye on Space Exploration | StarTalk,10K,8 years,"About StarTalk: Host Neil deGrasse Tyson brings together celebrities, scientists and comedians to explore a variety of cosmic ...",2024-01-30 07:57:00.456680
/watch?v=Xb0PYr9EgPk&pp=ygURc3BhY2UgZXhwbG9yYXRpb24%3D,/@masterclass,MasterClass,Chris Hadfield Teaches Space Exploration | Official Trailer | MasterClass,9.1M,3 years,"Retired astronaut Chris Hadfield teaches everything he knows about exploring space. Through personal stories, chalkboard ...",2024-01-30 07:57:00.468641
/watch?v=hI4X14YCQho&pp=ygURc3BhY2UgZXhwbG9yYXRpb24%3D,/@jakov_edits,Jakov from Wogastisburg,Little Dark Age - SPACE EXPLORATION,27K,1 year,#littledarkage #sun #mercury #venus #earth #mars #asteroid #jupiter #saturn #uranus #neptune #pluto #ceres #makemake ...,2024-01-30 07:57:11.985249
/watch?v=upp9-w6GPhU&pp=ygURc3BhY2UgZXhwbG9yYXRpb24%3D,/@TEDEd,TED-Ed,Could we survive prolonged space travel? - Lisa Nip,410K,7 years,"Prolonged space travel plays a severe toll on the human body: microgravity impairs muscle and bone growth, and high doses of ...",2024-01-30 07:57:11.988536
/watch?v=6-4AwCAVbmE&pp=ygURc3BhY2UgZXhwbG9yYXRpb24%3D,/@InsaneCuriosity,Insane Curiosity,Why  Space Research  Is So Important!,23K,3 years,"In recent years, people's interest in all countries on the planet in space exploration has soared. Many controversies have been ...",2024-01-30 07:57:11.992113
/watch?v=yZEt5oKoTI4&pp=ygURc3BhY2UgZXhwbG9yYXRpb24%3D,/@DoshDoshington,DoshDoshington,The Space Exploration Retrospective,347K,1 year,"In this video, I tell you how I really feel. https://www.patreon.com/Zyllius.",2024-01-30 07:57:11.995551
/watch?v=xvcGozey22Y&pp=ygURc3BhY2UgZXhwbG9yYXRpb24%3D,/@Space_Chip,Space Chip,SpaceEngine Exploration #2,232K,7 months,"This Spaceengine Video is WAY more relaxed than my usual stuff, but it's been requested a lot. I hope you guys enjoy the video!",2024-01-30 07:57:11.998308
/watch?v=Skk3YHMXeaw&pp=ygURc3BhY2UgZXhwbG9yYXRpb24%3D,/@futurize456,Futurize,Scariest Space Images LEAKED By NASA Astronauts,377K,6 months,Those images can spin your perspective on space exploration to 180 degrees- something the agency desperately wants to avoid!,2024-01-30 07:57:12.001175
/watch?v=Lk8KG1T-HZ8&pp=ygURc3BhY2UgZXhwbG9yYXRpb24%3D,/@realscience,Real Science,The Problem with Deep Space Travel,994K,1 year,Music: Resolve by Jamie Bathgate A Moon Walk---instrumental-version by Yehezkel Raz Death In Space by Jon Gegelman ...,2024-01-30 07:57:12.004954
/watch?v=okkOWxGgrE8&pp=ygURc3BhY2UgZXhwbG9yYXRpb24%3D,/@SparkDocs,Spark,How America Won The Space Race (Apollo Documentary) | Spark,708K,1 year,"In July 1969, the crew of the Apollo 11 was preparing for the United States' first attempt of landing men on the moon. In just 9 ...",2024-01-30 07:57:12.007740
/watch?v=DHIdrmC64WU&pp=ygURc3BhY2UgZXhwbG9yYXRpb24%3D,/@Space_Chip,Space Chip,SpaceEngine Exploration #1,264K,9 months,"Music for this video is from Stellardrone, a Lithuanian composer who releases all music public domain. Find his music here: ...",2024-01-30 07:57:12.010496
/watch?v=32sdyHYSPQc&pp=ygURc3BhY2UgZXhwbG9yYXRpb24%3D,/@KiteandKeyMedia,Kite & Key Media,Is Space Exploration Worth It?,89K,1 year,You've probably heard the argument: Space exploration isn't worth the cost. It takes resources away from vital needs here on ...,2024-01-30 07:57:12.013086
/watch?v=Y_plhk1FUQA&pp=ygURc3BhY2UgZXhwbG9yYXRpb24%3D,/@naturerelaxationfilms,Nature Relaxation Films,"COSMIC RELAXATION: 8 HOURS of 4K Deep Space NASA Footage + Chillout Music for Studying, Working, Etc",7.8M,5 years,ABOUT NATURE RELAXATION™ FILMS BY DAVID HUTING From soaring over majestic mountaintops in Patagonia to swimming ...,2024-01-30 07:57:12.015718
/watch?v=7hGrnXqfTFM&pp=ygURc3BhY2UgZXhwbG9yYXRpb24%3D,/@Hogi,Hogi! Pinkfong - Learn & Play,[ALL] Hogi's Space Exploration | Booksplore: Planet Exploration Cartoon | Learn with Hogi & Pinkfong,6.7M,2 years,Hogi's Booksplore has come to an end! Watch the complete season! ⭐️Check out new videos from Hogi and friends!,2024-01-30 07:57:12.019152
/watch?v=p6WZKoVcmoE&pp=ygURc3BhY2UgZXhwbG9yYXRpb24%3D,/@Zisteau,Zisteau,Appetite for Naquitite - Factorio Space Exploration #21,24K,9 months,"Factorio. A game about space. The space between resources, like outerspace ya know. In between the planets where the ...",2024-01-30 07:57:12.021962
/watch?v=1eGB3MPWCOo&pp=ygURc3BhY2UgZXhwbG9yYXRpb24%3D,/@ARStudiosGaming,AR Studios Gaming,HOW TO Automate Rocket Launches in Factorio Space Exploration,22K,1 year,"In this video, I aim to explain circuits for those who don't know and then how to apply those basic ideas in order to signal a rocket ...",2024-01-30 07:57:12.025296
/watch?v=tBiuhOlgJsY&pp=ygURc3BhY2UgZXhwbG9yYXRpb24%3D,/@NASAgovVideo,NASA Video,Radiation and Human Space Exploration,14K,10 years,"Just outside the protective layer of Earth's atmosphere and magnetosphere, is a universe full of radiation. What happens to our ...",2024-01-30 07:57:12.028881
/watch?v=g72qr9tOGUM&pp=ygURc3BhY2UgZXhwbG9yYXRpb24%3D,/@dwnews,DW News,Why 2023 is set to be an unprecedented year for space exploration | DW News,50K,1 year,"2022 was one of the biggest years in space exploration, with many achievements that point to the potential for an event-filled ...",2024-01-30 07:57:12.031612
/watch?v=4dqcII1Y3I4&pp=ygURc3BhY2UgZXhwbG9yYXRpb24%3D,/@blackholerecordings,Black Hole Recordings,Cosmic Gate - Exploration Of Space (Cosmic Gate's Back 2 The Future Remix),795K,13 years,Black Hole 354-0 Cosmic Gate -- Exploration Of Space (2011 Remixes) 1.Cosmic Gate's Back 2 The Future Remix // 2.Spencer ...,2024-01-30 07:57:12.034547
/watch?v=AttZCT-OPmc&pp=ygURc3BhY2UgZXhwbG9yYXRpb24%3D,/@klt,KLT,Exploring Space!,583K,9 months,Come learn about all kinds of ways we explore space! Subscribe to KLT: ...,2024-01-30 07:57:12.037165
/watch?v=2kpGx9ho02g&pp=ygURc3BhY2UgZXhwbG9yYXRpb24%3D,/@TVQuantumUniverse,TV - Quantum Universe,The Search For Elusive Planets is Over | Space Documentary | 3 Decades of Research of X File Mystery,10M,3 years,"Astronomers are vetting a technique that could aid the hunt for Planet ... for Planet Nine, astronomers eye a new search technique ...",2024-01-30 07:57:12.039624
/watch?v=nq4tT68UoCg&pp=ygURc3BhY2UgZXhwbG9yYXRpb24%3D,/@RelaxationMeditationMusic,Relaxation Ambient Music,✨  Space Ambient Music • Deep Relaxation Space Journey [ 4K UHD ],2.8M,2 years,"Space Ambient Music [ Space Exploration ]. It is an excellent ambient Cosmic soundscape Background for Space exploring, ...",2024-01-30 07:57:12.042268
